{
    "$schema": "http://json-schema.org/draft-04/schema#",
    "$id": "https://raw.githubusercontent.com/umccr/orcabus/main/docs/schemas/events/sequencerunmanager/SequenceRunSampleSheetChange.schema.json",
    "description": "EventBridge custom event schema for orcabus.sequencerunmanager@SequenceRunSampleSheetChange",
    "title": "AWSEvent",
    "type": "object",
    "required": [
        "detail-type",
        "detail",
        "source"
    ],
    "properties": {
        "id": {
            "type": "string"
        },
        "region": {
            "type": "string"
        },
        "resources": {
            "type": "array",
            "items": {
                "type": "string"
            }
        },
        "source": {
            "type": "string"
        },
        "time": {
            "type": "string",
            "format": "date-time"
        },
        "version": {
            "type": "string"
        },
        "account": {
            "type": "string"
        },
        "detail-type": {
            "type": "string"
        },
        "detail": {
            "$ref": "#/definitions/SequenceRunSampleSheetChange"
        }
    },
    "definitions": {
        "SequenceRunSampleSheetChange": {
            "type": "object",
            "required": [
                "instrumentRunId",
                "sequenceRunId",
                "sequenceRunOrcabusId",
                "timeStamp",
                "sampleSheetName",
                "samplesheetbase64gz"
            ],
            "properties": {
                "instrumentRunId": {
                    "type": "string"
                },
                "sequenceRunId": {
                    "type": "string"
                },
                "sequenceRunOrcabusId": {
                    "type": "string"
                },
                "timeStamp": {
                    "type": "string"
                },
                "sampleSheetName": {
                    "type": "string"
                },
                "samplesheetbase64gz": {
                    "type": "string"
                }
            }
        }
    }
}